{
  "build": {
    "contentHash": "da1b05988d03744643349d0bf2af628d6fe73576a2df2adc7f9fd9855995284f",
    "indexerId": "codebase-indexer",
    "indexerVersion": "0.1.0",
    "repoRoot": "."
  },
  "diagnostics": {
    "errors": [],
    "warnings": [
      {
        "code": "I-101",
        "message": "spec \"111-org-agent-catalog-sync\" declares implements path \"platform/services/stagecraft/web/app/routes/app.workspace.agents.tsx\" which is not a known package, adapter, or existing file/directory"
      },
      {
        "code": "I-101",
        "message": "spec \"113-stagecraft-projects-rename-and-clone\" declares implements path \"platform/services/stagecraft/api/projects/clone.test.ts\" which is not a known package, adapter, or existing file/directory"
      },
      {
        "code": "I-101",
        "message": "spec \"119-project-as-unit-of-governance\" declares implements path \"platform/services/stagecraft/api/workspaces\" which is not a known package, adapter, or existing file/directory"
      },
      {
        "code": "I-101",
        "message": "spec \"121-claim-provenance-enforcement\" declares implements path \"crates/factory-engine/skills/business-requirements-analyst.md\" which is not a known package, adapter, or existing file/directory"
      },
      {
        "code": "I-101",
        "message": "spec \"121-claim-provenance-enforcement\" declares implements path \"crates/factory-engine/skills/validate.md\" which is not a known package, adapter, or existing file/directory"
      },
      {
        "code": "I-101",
        "message": "spec \"121-claim-provenance-enforcement\" declares implements path \"crates/factory-engine/src/stages/s1_business_requirements.rs\" which is not a known package, adapter, or existing file/directory"
      },
      {
        "code": "I-101",
        "message": "spec \"121-claim-provenance-enforcement\" declares implements path \"crates/provenance-validator/src/anchor.rs\" which is not a known package, adapter, or existing file/directory"
      },
      {
        "code": "I-101",
        "message": "spec \"121-claim-provenance-enforcement\" declares implements path \"platform/services/stagecraft/api/governance/provenancePolicy.ts\" which is not a known package, adapter, or existing file/directory"
      },
      {
        "code": "I-101",
        "message": "spec \"122-stakeholder-doc-inversion\" declares implements path \"crates/factory-engine/skills/client-document-comparator.md\" which is not a known package, adapter, or existing file/directory"
      },
      {
        "code": "I-101",
        "message": "spec \"122-stakeholder-doc-inversion\" declares implements path \"crates/factory-engine/skills/project-charter-comparator.md\" which is not a known package, adapter, or existing file/directory"
      }
    ]
  },
  "factory": [],
  "infrastructure": {
    "agents": [
      {
        "description": "Use this agent to plan and decompose tasks, validate implementation approaches against the spec spine, and produce structured work plans. Triggered when asked to plan, design, decompose, or architect a change — or before starting any complex feature.",
        "name": "architect",
        "path": ".claude/agents/architect.md"
      },
      {
        "description": "Encore.ts framework specialist for stagecraft service development",
        "name": "encore-expert",
        "path": ".claude/agents/encore-expert.md"
      },
      {
        "description": "Use this agent to investigate the codebase, gather context, trace dependencies, and answer questions about how things work. Triggered when asked to explore, search, trace, find, or explain existing code or architecture.",
        "name": "explorer",
        "path": ".claude/agents/explorer.md"
      },
      {
        "description": "Use this agent to execute focused code changes from an existing plan. Triggered when asked to implement, apply, code, build, or write changes — especially when a plan or spec already exists.",
        "name": "implementer",
        "path": ".claude/agents/implementer.md"
      },
      {
        "description": "Use this agent to review code changes for bugs, security issues, performance problems, and spec compliance. Triggered after implementation, or when asked to review, audit, or check recent changes.",
        "name": "reviewer",
        "path": ".claude/agents/reviewer.md"
      }
    ],
    "commands": [
      {
        "description": "Run dead code and duplicate detection, get categorized cleanup recommendations",
        "name": "cleanup",
        "path": ".claude/commands/cleanup.md"
      },
      {
        "description": "Multi-aspect code review using parallel sub-agents with adaptive agent selection",
        "name": "code-review",
        "path": ".claude/commands/code-review.md"
      },
      {
        "description": "Create a git commit with an impact-focused conventional commit message",
        "name": "commit",
        "path": ".claude/commands/commit.md"
      },
      {
        "description": "Execute a plan file step-by-step with progress tracking and phase checkpoints",
        "name": "implement-plan",
        "path": ".claude/commands/implement-plan.md"
      },
      {
        "description": "Initialize an open-agentic-platform session by loading core repository context, recent activity, and memory before implementation work begins.",
        "name": "init",
        "path": ".claude/commands/init.md"
      },
      {
        "description": "Modularize large CLAUDE.md files with path-scoped rules and doc extraction",
        "name": "refactor-claude-md",
        "path": ".claude/commands/refactor-claude-md.md"
      },
      {
        "description": "Deep research with parallel sub-agents, query classification, and filesystem artifact passing",
        "name": "research",
        "path": ".claude/commands/research.md"
      },
      {
        "description": "Review all changes in the current branch with structured read-only analysis across risk, quality, and platform compatibility dimensions.",
        "name": "review-branch",
        "path": ".claude/commands/review-branch.md"
      },
      {
        "description": "One-time contributor setup — run `make setup` and verify governed reads work end-to-end so `/init` can report lifecycle and structural counts.",
        "name": "setup",
        "path": ".claude/commands/setup.md"
      },
      {
        "description": "Run the local fast CI loop (`make ci`) and automatically fix discovered issues using concurrent agents",
        "name": "validate-and-fix",
        "path": ".claude/commands/validate-and-fix.md"
      }
    ],
    "rules": [
      {
        "name": "adversarial-prompt-refusal",
        "path": ".claude/rules/adversarial-prompt-refusal.md"
      },
      {
        "name": "governed-artifact-reads",
        "path": ".claude/rules/governed-artifact-reads.md"
      },
      {
        "name": "orchestrator-rules",
        "path": ".claude/rules/orchestrator-rules.md"
      }
    ],
    "schemas": [
      {
        "description": "Unified Agent and Skill Frontmatter (spec 054)",
        "name": "agent-frontmatter.schema",
        "path": "schemas/agent-frontmatter.schema.json"
      },
      {
        "description": "Open Agentic Platform — compiled codebase index (spec 101)",
        "name": "codebase-index.schema",
        "path": "schemas/codebase-index.schema.json"
      },
      {
        "description": "OAP skill definition frontmatter",
        "name": "skill-frontmatter.schema",
        "path": "schemas/skill-frontmatter.schema.json"
      }
    ],
    "tools": [
      {
        "binaries": [
          "adapter-scopes-compiler"
        ],
        "name": "adapter-scopes-compiler",
        "path": "tools/adapter-scopes-compiler"
      },
      {
        "binaries": [
          "assumption-cascade-check"
        ],
        "name": "assumption-cascade-check",
        "path": "tools/assumption-cascade-check"
      },
      {
        "binaries": [
          "ci-parity-check"
        ],
        "name": "ci-parity-check",
        "path": "tools/ci-parity-check"
      },
      {
        "binaries": [
          "codebase-indexer"
        ],
        "name": "codebase-indexer",
        "path": "tools/codebase-indexer"
      },
      {
        "binaries": [
          "policy-compiler"
        ],
        "name": "policy-compiler",
        "path": "tools/policy-compiler"
      },
      {
        "binaries": [
          "registry-consumer"
        ],
        "name": "registry-consumer",
        "path": "tools/registry-consumer"
      },
      {
        "binaries": [
          "spec-code-coupling-check"
        ],
        "name": "spec-code-coupling-check",
        "path": "tools/spec-code-coupling-check"
      },
      {
        "binaries": [
          "spec-compiler"
        ],
        "name": "spec-compiler",
        "path": "tools/spec-compiler"
      },
      {
        "binaries": [
          "spec-lint"
        ],
        "name": "spec-lint",
        "path": "tools/spec-lint"
      },
      {
        "binaries": [
          "stakeholder-doc-lint"
        ],
        "name": "stakeholder-doc-lint",
        "path": "tools/stakeholder-doc-lint"
      }
    ]
  },
  "inventory": [
    {
      "externalDeps": [
        "@hookform/resolvers",
        "@radix-ui/react-dialog",
        "@radix-ui/react-dropdown-menu",
        "@radix-ui/react-label",
        "@radix-ui/react-popover",
        "@radix-ui/react-radio-group",
        "@radix-ui/react-select",
        "@radix-ui/react-switch",
        "@radix-ui/react-tabs",
        "@radix-ui/react-toast",
        "@radix-ui/react-tooltip",
        "@tailwindcss/cli",
        "@tailwindcss/vite",
        "@tanstack/react-virtual",
        "@tauri-apps/api",
        "@tauri-apps/cli",
        "@tauri-apps/plugin-autostart",
        "@tauri-apps/plugin-dialog",
        "@tauri-apps/plugin-fs",
        "@tauri-apps/plugin-global-shortcut",